{
  "schema_id": "artifact-memory/platform-matrix-receipt/v1",
  "profile": "v0-case-sensitive-unicode-codepoint",
  "runtime": {"family": "windows", "python": "3.12.10"},
  "observations": {
    "case_sensitivity": false,
    "unicode_name_behavior": "distinct-names",
    "symlink_behavior": "created-but-v0-scan-unsupported",
    "timestamps": "ignored-by-v0-profile",
    "mount_layout": "logical-relative-paths-only"
  },
  "diagnostics": [],
  "limitations": [
    "probe observations describe this runner only",
    "v0 does not infer Unicode normalization equivalence",
    "v0 scan treats symlinks as explicitly unsupported"
  ]
}
